{
  "schemaVersion": 1,
  "selectedProviderId": "anthropic",
  "observedProviderId": "anthropic",
  "resolvedModelId": "claude-sonnet-4-5-2025-09-29",
  "adapterId": "1111111111111111111111111111111111111111111111111111111111111111",
  "logicalPrefixSha256": "2222222222222222222222222222222222222222222222222222222222222222",
  "prefixSha256": "3333333333333333333333333333333333333333333333333333333333333333",
  "capability": {
    "mode": "standard",
    "aggregate": "unknown",
    "statelessProof": null
  },
  "cacheStatus": "unknown",
  "normalizedUsage": {
    "attempts": [],
    "requests": [],
    "aggregate": {
      "totalInputTokens": 0,
      "uncachedInputTokens": 0,
      "cacheWriteInputTokens": 0,
      "cacheReadInputTokens": 0,
      "outputTokens": 0,
      "requestCount": 0,
      "attemptCount": 0
    }
  },
  "retryObservations": {
    "requests": [],
    "aggregate": {
      "requestCount": 0,
      "attemptCount": 0,
      "succeededCount": 0,
      "failedCount": 0,
      "cancelledCount": 0
    }
  },
  "errorCodes": [],
  "telemetryCompleteness": {
    "usage": "missing",
    "cache": "missing",
    "statelessProof": "notApplicable",
    "aggregate": "missing"
  },
  "producingRunId": "17123456789",
  "runAttempt": 1,
  "interactionId": "4444444444444444444444444444444444444444444444444444444444444444",
  "consumedInputSha256": "5555555555555555555555555555555555555555555555555555555555555555",
  "resultSha256": "6666666666666666666666666666666666666666666666666666666666666666",
  "traceSha256": "7777777777777777777777777777777777777777777777777777777777777777",
  "predecessorLedgerSha256": "bootstrap",
  "candidateLedgerSha256": "8888888888888888888888888888888888888888888888888888888888888888"
}
