{
  "schemaVersion": 1,
  "selectedProviderId": "anthropic",
  "observedProviderId": "anthropic",
  "resolvedModelId": "claude-sonnet-4-5-2025-09-29",
  "adapterId": "1111111111111111111111111111111111111111111111111111111111111111",
  "logicalPrefixSha256": "2222222222222222222222222222222222222222222222222222222222222222",
  "prefixSha256": "3333333333333333333333333333333333333333333333333333333333333333",
  "capability": {
    "mode": "standard",
    "aggregate": "eligible",
    "statelessProof": null
  },
  "cacheStatus": "partial",
  "normalizedUsage": {
    "attempts": [
      {
        "requestOrdinal": 0,
        "attemptOrdinal": 0,
        "outcome": "succeeded",
        "capability": "eligible",
        "cacheStatus": "miss",
        "usageCompleteness": "complete",
        "totalInputTokens": 200,
        "uncachedInputTokens": 100,
        "cacheWriteInputTokens": 100,
        "cacheReadInputTokens": 0,
        "outputTokens": 20,
        "attemptErrorCodes": []
      },
      {
        "requestOrdinal": 1,
        "attemptOrdinal": 0,
        "outcome": "succeeded",
        "capability": "eligible",
        "cacheStatus": "hit",
        "usageCompleteness": "complete",
        "totalInputTokens": 200,
        "uncachedInputTokens": 0,
        "cacheWriteInputTokens": 0,
        "cacheReadInputTokens": 200,
        "outputTokens": 25,
        "attemptErrorCodes": []
      }
    ],
    "requests": [
      {
        "requestOrdinal": 0,
        "capability": "eligible",
        "cacheStatus": "miss",
        "usageCompleteness": "complete",
        "totalInputTokens": 200,
        "uncachedInputTokens": 100,
        "cacheWriteInputTokens": 100,
        "cacheReadInputTokens": 0,
        "outputTokens": 20
      },
      {
        "requestOrdinal": 1,
        "capability": "eligible",
        "cacheStatus": "hit",
        "usageCompleteness": "complete",
        "totalInputTokens": 200,
        "uncachedInputTokens": 0,
        "cacheWriteInputTokens": 0,
        "cacheReadInputTokens": 200,
        "outputTokens": 25
      }
    ],
    "aggregate": {
      "totalInputTokens": 400,
      "uncachedInputTokens": 100,
      "cacheWriteInputTokens": 100,
      "cacheReadInputTokens": 200,
      "outputTokens": 45,
      "requestCount": 2,
      "attemptCount": 2
    }
  },
  "retryObservations": {
    "requests": [
      {
        "requestOrdinal": 0,
        "attemptCount": 1,
        "succeededCount": 1,
        "failedCount": 0,
        "cancelledCount": 0
      },
      {
        "requestOrdinal": 1,
        "attemptCount": 1,
        "succeededCount": 1,
        "failedCount": 0,
        "cancelledCount": 0
      }
    ],
    "aggregate": {
      "requestCount": 2,
      "attemptCount": 2,
      "succeededCount": 2,
      "failedCount": 0,
      "cancelledCount": 0
    }
  },
  "errorCodes": [],
  "telemetryCompleteness": {
    "usage": "complete",
    "cache": "complete",
    "statelessProof": "notApplicable",
    "aggregate": "complete"
  },
  "producingRunId": "17123456789",
  "runAttempt": 1,
  "interactionId": "4444444444444444444444444444444444444444444444444444444444444444",
  "consumedInputSha256": "5555555555555555555555555555555555555555555555555555555555555555",
  "resultSha256": "6666666666666666666666666666666666666666666666666666666666666666",
  "traceSha256": "7777777777777777777777777777777777777777777777777777777777777777",
  "predecessorLedgerSha256": "9999999999999999999999999999999999999999999999999999999999999999",
  "candidateLedgerSha256": "8888888888888888888888888888888888888888888888888888888888888888"
}
