{
  "schemaVersion": 1,
  "selectedProviderId": "anthropic",
  "observedProviderId": "anthropic",
  "resolvedModelId": "claude-sonnet-4-5-2025-09-29",
  "adapterId": "1111111111111111111111111111111111111111111111111111111111111111",
  "logicalPrefixSha256": "2222222222222222222222222222222222222222222222222222222222222222",
  "prefixSha256": "3333333333333333333333333333333333333333333333333333333333333333",
  "capability": {
    "mode": "standard",
    "aggregate": "unsupported",
    "statelessProof": null
  },
  "cacheStatus": "unsupported",
  "normalizedUsage": {
    "attempts": [
      {
        "requestOrdinal": 0,
        "attemptOrdinal": 0,
        "outcome": "failed",
        "capability": "ineligible",
        "cacheStatus": "miss",
        "usageCompleteness": "missing",
        "totalInputTokens": null,
        "uncachedInputTokens": null,
        "cacheWriteInputTokens": null,
        "cacheReadInputTokens": null,
        "outputTokens": null,
        "attemptErrorCodes": ["provider_4xx"]
      }
    ],
    "requests": [
      {
        "requestOrdinal": 0,
        "capability": "ineligible",
        "cacheStatus": "miss",
        "usageCompleteness": "missing",
        "totalInputTokens": null,
        "uncachedInputTokens": null,
        "cacheWriteInputTokens": null,
        "cacheReadInputTokens": null,
        "outputTokens": null
      }
    ],
    "aggregate": {
      "totalInputTokens": null,
      "uncachedInputTokens": null,
      "cacheWriteInputTokens": null,
      "cacheReadInputTokens": null,
      "outputTokens": null,
      "requestCount": 1,
      "attemptCount": 1
    }
  },
  "retryObservations": {
    "requests": [
      {
        "requestOrdinal": 0,
        "attemptCount": 1,
        "succeededCount": 0,
        "failedCount": 1,
        "cancelledCount": 0
      }
    ],
    "aggregate": {
      "requestCount": 1,
      "attemptCount": 1,
      "succeededCount": 0,
      "failedCount": 1,
      "cancelledCount": 0
    }
  },
  "errorCodes": ["provider_4xx"],
  "telemetryCompleteness": {
    "usage": "missing",
    "cache": "complete",
    "statelessProof": "notApplicable",
    "aggregate": "partial"
  },
  "producingRunId": "17123456789",
  "runAttempt": 1,
  "interactionId": "4444444444444444444444444444444444444444444444444444444444444444",
  "consumedInputSha256": "5555555555555555555555555555555555555555555555555555555555555555",
  "resultSha256": "6666666666666666666666666666666666666666666666666666666666666666",
  "traceSha256": "7777777777777777777777777777777777777777777777777777777777777777",
  "predecessorLedgerSha256": "bootstrap",
  "candidateLedgerSha256": "8888888888888888888888888888888888888888888888888888888888888888"
}
